id,claim,type,verifier,status
C01,"2025 US utility-scale generation mix — natural gas 41%, nuclear 18%, coal 17%, wind 11%, solar 7%, hydro 6%, biomass ~1%, geothermal <1%, petroleum 0.7%; fossil fuels ~58%, all renewables 24%; total 4.43 trillion kWh (a record, +2.8% vs 2024); coal is the third-highest source (behind gas and nuclear) and wind+solar combined (18%) edged out coal (17%)",CITE,EIA 'Electricity in the U.S.' (eia.gov/energyexplained/electricity/electricity-in-the-us.php) 2025 data — audited,ESTABLISHED
C02,"Wind+solar combined (18%) exceeded coal (17%) for a second consecutive year in 2025, and US power-sector emissions rose for a second consecutive year",CITE,EIA electricity data (eia.gov) 2025 — audited (EIA-consistent),ESTABLISHED
C02b,"The precise magnitude of the 2025 power-sector CO2 rise — about +4.4% — is attributed to the Distilled/Canary Media analysis of EIA data, not an EIA-official figure; recorded as attributed, not asserted",REPORTED,Canary2026 / Distilled analysis of EIA data — attributed in prose, not independently reproduced,REPORTED
C03,"Interconnection queues held ~2,290 GW active at end-2024 (~2x the installed fleet); ~14% historical completion rate; ~55-month median waits; a record ~112 GW of solar+storage withdrew in 2024",CITE,LBNL 'Queued Up' 2025 edition (emp.lbl.gov) — audited,ESTABLISHED
C04,"Lazard 2026 LCOE+ unsubsidized new-build ranges ($/MWh): utility solar 40–98, onshore wind 37–99, offshore wind 105–167, CCGT 51–129, gas peaking 144–276, nuclear 175–255; renewables cheapest new-build, LCOE rising across every technology",CITE,Lazard 2026 LCOE+ report — audited,ESTABLISHED
C05,"Large-frame gas turbines are effectively sold out toward 2030; lead times 5–7 years; equipment prices up ~300% in three years",CITE,GE Vernova disclosures / IEEFA 2025 — audited,ESTABLISHED
C06,"Grid Strategies' National Load Growth Report (Nov 2025) forecasts ~166 GW of US peak-load growth by 2030, roughly 90 GW of it from data centers — the first sustained US demand growth in ~20 years, about half from data centers",CITE,Grid Strategies National Load Growth Report (Nov 2025) — audited,ESTABLISHED
C07,"Grid-enhancing technologies and advanced reconductoring can unlock large grid capacity on existing rights-of-way in months, not years — under-deployed for incentive/regulatory reasons, not technical ones",CITE,WATT2025; CGEP2026; PNAS2024 — dossier.html citation audit,ESTABLISHED
C08,"Utility-scale solar + storage is the cheapest and fastest-to-deploy new generation; the binding constraint is interconnection, not cost",CITE,LazardLCOE2026; EIA2025mix; EIASTEO2026 — dossier.html citation audit,ESTABLISHED
C09,"Enhanced geothermal is expected to deliver firm, clean, 24/7 power at commercial scale with a steep cost-down curve",FORECAST,"signpost: Fervo Cape Station Phase 1 (100 MW) delivering by end-2026; 500 MW by end-2028",FORECAST
C10,"Nuclear restarts and uprates are the fastest firm CLEAN megawatts available today, but capped to a handful of restartable sites",CITE,Constellation2025; WNN2024 — dossier.html citation audit,ESTABLISHED
C11,"Onshore wind remains among the cheapest new-build, but siting/permitting headwinds and a sharp LCOE rise are slowing additions",CITE,LazardLCOE2026; EIASTEO2026 — dossier.html citation audit,ESTABLISHED
C12,"Natural gas CCGT is the indispensable near-term firm bridge — not clean, and now equipment-constrained as large-frame turbines sell out through 2030",CITE,GEV2026; IEEFA2025 — dossier.html citation audit,ESTABLISHED
C13,"A US SMR is expected to deliver commercial power to the grid, but every first unit is a first-of-a-kind and no Western SMR is yet in commercial operation",FORECAST,signpost: a US SMR delivers commercial power to the grid by end-2030 (Kairos/Oklo/TerraPower),FORECAST
C14,"Offshore wind is a real resource on a hard path — most expensive mainstream new-build and highly exposed to policy reversal",FORECAST,signpost: Coastal Virginia Offshore Wind (~2.6 GW) reaches full commercial operation on its stated schedule,OPEN-CAVEATED
C15,"Fusion's net-energy physics is settled; the open questions are engineering, cost, and timeline, with grid-relevant scale 2030s-plus",FORECAST,signpost: CFS SPARC demonstrates net energy gain (Q>1) by end-2027,OPEN-UNVERIFIED
C16,"Space-based solar power is proven in principle (orbit-to-ground beaming demonstrated), but full-system economics remain decades out",REPORTED,signpost: a paying, revenue space-to-grid power delivery occurs by 2030,REPORTED
C17,"Near-term load growth is expected to outpace the pace of generation interconnection and transmission buildout, implying a supply/reliability gap in specific regions by specific years — defensible as a directional argument, not a precise prediction",FORECAST,signpost: NERC Long-Term Reliability Assessment elevated/high-risk designations persist or expand through 2028,OPEN-CAVEATED
C18,"The Tier 1–4 avenue ranking is a sequencing lens under an explicit criterion (fastest clean/firm/scalable MW per dollar, weighted to clearing the bottleneck) — non-binding, not a claim about which technology wins",NOVEL,synthesis argument — criterion stated in §05; counter-view given at equal prominence,OPEN-CAVEATED
C19,"A US fast-spectrum reactor plus a sustained recycling (closed-fuel-cycle) pathway is expected to demonstrate commercial-scale operation with the residual waste's dangerous custody-time reduced to the order of centuries; the waste benefit follows the neutron SPECTRUM (fast), not the molten-salt coolant",FORECAST,"signpost: a US fast-spectrum reactor + recycling pathway demonstrates commercial-scale operation with waste custody-time reduced to the order of centuries, by 2035",FORECAST
C20,"CAISO curtailed 3.4 million MWh of wind+solar in 2024, up 29% year-over-year, with congestion a primary driver — a clean primary-source slice of national curtailment",CITE,EIA Today in Energy (May 2025) — audited (primary),ESTABLISHED
C21,"In 2024 roughly 20 million MWh of US wind+solar output was curtailed (deliberately not produced, largely because transmission was full); four of seven ISOs set curtailment records and ERCOT alone curtailed more than 8 TWh — an industry-analysis aggregate, recorded as attributed (not a single reproducible primary)",REPORTED,Amperon 2026 analysis; Modo Energy 2025 (ERCOT) — attributed industry aggregate,REPORTED
C22,"New transmission capacity does not wait on new generation: it fills in sequence — (1) currently-curtailed existing generation, immediately; (2) queue projects whose binding constraint is connection; (3) new build. Reconductoring is the cork on generation that already exists. Counter-view: curtailment is concentrated in specific regions (West Texas, California) so reconductoring elsewhere does not tap it; some curtailment is oversupply not congestion, which wires alone do not fix; and storage competes with wires as the curtailment fix",NOVEL,"OPEN-ARGUMENT; builds on C20/C21; counter-view stated at equal prominence in §03 Act I",OPEN-CAVEATED
C23,"The long-lived hazard in spent fuel is the transuranics created in fission (Pu-239 half-life ~24,000 yr), not the uranium itself; untreated spent fuel takes on the order of 100,000+ years to decay to the radiotoxicity of the ore it came from, whereas a fast-reactor closed fuel cycle reduces the residual to a custody time of roughly 300–500 years — fast-spectrum neutrons can fission transuranics, thermal-spectrum ones mostly cannot (IAEA: ~30 g per kg needing 200–300 yr; peer-reviewed equilibrium ~500 yr)",CITE,IAEA Bulletin + Progress in Nuclear Energy actinide-recycling literature — audited (physics),ESTABLISHED
C24,"The waste-lifetime benefit follows the neutron SPECTRUM, not the coolant/fuel-form: salt-cooled THERMAL designs (Kairos KP-FHR, NuScale VOYGR, GE-Hitachi BWRX-300, X-energy Xe-100) get no waste-lifetime benefit; the fast-spectrum US near-term designs are Oklo Aurora (15 MW, sodium, INL, ~2028) and TerraPower Natrium (345 MWe, sodium, Kemmerer WY, ~2030); fast molten-salt designs (TerraPower MCFR, Moltex SSR-W) sit further out",CITE,World Nuclear News + vendor design documentation — descriptive design facts,ESTABLISHED
C25,"A fast-vs-thermal cost premium is expected via HALEU fuel (~19% enriched, ~2.5–3x natural-U per kWh, currently scarce), sodium handling, and longer Gen-IV licensing, but its MAGNITUDE is not yet demonstrated: Natrium FOAK ~$4B/345 MW ≈ ~$11.6k/kW (roughly half DOE-funded) while the cancelled NuScale THERMAL project reached ~$20k/kW, so FOAK noise swamps the spectrum effect; FOAK SMRs generally land ~$80–150/MWh with ~$50–80/MWh NOAK targets",FORECAST,"signpost: a fast-vs-thermal $/MWh premium is isolated from FOAK noise once multiple US SMRs (fast and thermal) reach NOAK",OPEN-CAVEATED
